<?xml version="1.0" encoding="UTF-8"?>
<!--
 *
 * This is a simple Content Management System (CMS)
 * Copyright (C) 2009  Imran M Yousuf (imyousuf@smartitengineering.com)
 *
 * This program is free software: you can redistribute it and/or modify
 * it under the terms of the GNU General Public License as published by
 * the Free Software Foundation, either version 3 of the License, or
 * (at your option) any later version.
 *
 * This program is distributed in the hope that it will be useful,
 * but WITHOUT ANY WARRANTY; without even the implied warranty of
 * MERCHANTABILITY or FITNESS FOR A PARTICULAR PURPOSE.  See the
 * GNU General Public License for more details.
 *
 * You should have received a copy of the GNU General Public License
 * along with this program.  If not, see <http://www.gnu.org/licenses/>.
-->
<!--
    Document   : content-type-def-1.xml
    Created on : September 25, 2009, 1:10 PM
    Author     : imyousuf
    Description:
        Test content type definition.
-->
<contentTypes  xmlns:xsi='http://www.w3.org/2001/XMLSchema-instance'
   xmlns='http://www.smartitengineering.com/smart-cms/content/content-type-schema'
   xsi:schemaLocation='http://www.smartitengineering.com/smart-cms/content/content-type-schema ../../../../content-api-impl/src/main/resources/com/smartitengineering/cms/content/content-type-schema.xsd'>
  <contentType namespace="asdfasdf1">
    <name>XYZ</name>
    <fields>
      <field>
        <name>fieldA</name>
        <value>
          <content>
            <typeNS>asdfasdf1</typeNS>
            <typeName>XYZ</typeName>
          </content>
        </value>
      </field>
      <field>
        <name>fieldB</name>
        <value>
          <collection>
            <value>
              <integer />
            </value>
          </collection>
        </value>
      </field>
      <field>
        <name>fieldB</name>
        <value>
          <collection>
            <value>
              <content>
                <typeNS>jpeg</typeNS>
                <typeName>RST</typeName>
              </content>
            </value>
          </collection>
        </value>
      </field>
    </fields>
    <status>
      <statusName>draft</statusName>
      <statusName>marketed</statusName>
      <statusName>obselete</statusName>
    </status>
  </contentType>
  <contentType namespace="jpeg">
    <name>RST</name>
    <fields>
      <field>
        <name>image</name>
        <value>
          <other>
            <mimeType>image/jpeg</mimeType>
          </other>
        </value>
      </field>
    </fields>
    <status>
      <statusName>draft</statusName>
      <statusName>marketed</statusName>
      <statusName>obselete</statusName>
    </status>
  </contentType>
</contentTypes>
